<?xml version="1.0" encoding="UTF-8"?>
<!DOCTYPE application-j2ee-engine SYSTEM "application-j2ee-engine.dtd">
<application-j2ee-engine>
  <reference reference-type="hard">
    <reference-target target-type="library" provider-name="sap.com">engine.jee5.facade</reference-target>
  </reference>
  <reference reference-type="hard">
    <reference-target target-type="service" provider-name="sap.com">engine.security.facade</reference-target>
  </reference>
  <reference reference-type="hard">
    <reference-target target-type="library" provider-name="sap.com">com.sap.base.technology.facade</reference-target>
  </reference>
  <reference reference-type="weak">
    <reference-target target-type="interface" provider-name="sap.com">com.sap.aii.af.ifc.facade</reference-target>
  </reference>
  <reference reference-type="hard">
    <reference-target target-type="service" provider-name="sap.com">com.sap.aii.af.svc.facade</reference-target>
  </reference>
  <reference reference-type="hard">
    <reference-target target-type="library" provider-name="sap.com">com.sap.aii.af.lib.facade</reference-target>
  </reference>
  <modules-additional>
  </modules-additional>
  <provider-name>sap.com</provider-name>
</application-j2ee-engine>
